{
  "schema_version": "1",
  "record_type": "EvidenceRecord",
  "created_at": "2026-08-31T12:02:00Z",
  "correlation_id": "123e4567-e89b-42d3-a456-426614174000",
  "producer": "agent",
  "evidence_class": "STATIC_CHECKED",
  "input_digest": "sha256:4444444444444444444444444444444444444444444444444444444444444444",
  "output_digest": "sha256:5555555555555555555555555555555555555555555555555555555555555555",
  "environment_digest": "sha256:3333333333333333333333333333333333333333333333333333333333333333",
  "diagnostics": [
    "Recorded fixture; no vendor or physical execution"
  ]
}
